{"avg_pace_s_per_km":285.9,"best_efforts":[],"best_pace_s_per_km":285.9,"cadence_avg":159.4,"date":"2026-10-17","distance_m":780.0,"dynamics":{"gct_balance_pct":49.9,"gct_ms":283.9,"vert_osc_mm":117.1,"vert_ratio_pct":8.6},"elapsed_s":224,"elevation_gain_m":0.0,"elevation_loss_m":0.0,"flags":{},"hr":{"avg":141,"max":146},"hr_zones":[{"seconds":21,"zone":1},{"seconds":84,"zone":2},{"seconds":119,"zone":3},{"seconds":0,"zone":4},{"seconds":0,"zone":5},{"seconds":0,"zone":6},{"seconds":0,"zone":7}],"id":"2026-10-17-wxyj","is_race":false,"moving_s":223,"power_w_avg":572,"schema_version":1,"series":{"cadence":[150,152,152,152,154,154,154,154,154,156,156,156,158,158,158,160,160,160,160,160,160,160,160,160,160,160,160,160,160,160,160,160,160,160,160,160,162,162,162,162,162,162,162,162,162,162,162,162,162,162,162,162,162,162,162,162,162,162,162,162,162,162,162,162,162,162,162,162,162,162,162,162,162,162,160,162,160,160,162,162,162,162,162,162,162,160,160,160,160,160,160,160,160,160,160,160,160,160,160,160,160,160,162,162,160,160,160,162,160,160,160,160,160,160,160,160,160,160,160,160,160,160,160,160,160,158,158,158,158,158,160,160,160,158,158,158,160,160,160,160,160,160,158,158,158,158,158,158,158,160,160,160,160,158,158,158,160,160,160,160,160,160,158,158,158,158,158,158,158,158,158,158,158,158,158,160,160,160,160,160,158,158,158,158,158,158,158,158,158,158,158,158,158,158,158,158,158,158,158,158,158,158,158,158,158,158,158,158,158,158,158,158,158,158,158,158,158,158,158,158,156,156,156,156,156],"elev":[39.6,39.6,39.6,39.6,39.6,39.6,39.6,39.6,39.6,39.6,39.6,39.6,39.6,39.6,39.6,39.6,39.6,39.6,39.6,39.6,39.6,39.6,39.6,39.6,39.6,39.6,39.6,39.6,39.6,39.6,39.6,39.6,39.6,39.6,39.6,39.6,39.6,39.6,39.6,39.6,39.6,39.6,39.6,39.6,39.6,39.6,39.6,39.6,39.6,39.6,39.6,39.6,39.6,39.6,39.6,39.6,39.6,39.6,39.6,39.6,39.6,39.6,39.6,39.6,39.6,39.6,39.6,39.6,39.6,39.6,39.6,39.6,39.6,39.6,39.6,39.6,39.6,39.6,39.6,39.6,39.6,39.6,39.6,39.6,39.6,39.6,39.6,39.6,39.6,39.6,39.6,39.6,39.6,39.6,39.6,39.6,39.6,39.6,39.6,39.6,39.6,39.6,39.6,39.6,39.6,39.6,39.6,39.6,39.6,39.6,39.6,39.6,39.6,39.6,39.6,39.6,39.6,39.6,39.6,39.6,37.0,37.0,37.0,37.0,37.0,37.0,37.0,37.0,37.0,37.0,37.0,37.0,37.0,37.0,37.0,37.0,37.0,37.0,37.0,37.0,37.0,37.0,37.0,37.0,37.0,37.0,37.0,37.0,37.0,37.0,37.0,37.0,37.0,37.0,37.0,37.0,37.0,37.0,37.0,37.0,37.0,37.0,37.0,37.0,37.0,37.0,37.0,37.0,37.0,37.0,37.0,37.0,37.0,37.0,37.0,37.0,37.0,37.0,37.0,37.0,37.0,37.0,37.0,37.0,37.0,37.0,37.0,37.0,37.0,37.0,37.0,37.0,37.0,37.0,37.0,37.0,37.0,37.0,37.0,37.0,37.0,37.0,37.0,37.0,37.0,37.0,37.0,37.0,37.0,37.0,37.0,37.0,37.0,37.0,37.0,37.0,37.0,37.0,37.0,37.0,37.0,37.0,37.0,37.0,37.0],"hr":[122,119,112,115,116,117,118,120,121,123,125,128,130,131,132,132,133,133,132,133,133,135,134,135,135,136,136,136,136,137,137,137,137,137,138,137,139,139,139,139,138,139,139,139,139,139,139,139,139,139,139,140,140,139,140,140,140,141,141,141,141,141,142,142,142,142,143,143,143,144,143,143,143,143,142,143,143,143,142,143,142,142,143,142,142,143,143,142,142,143,142,143,144,143,143,144,144,143,143,144,143,144,144,144,143,143,143,143,143,144,143,143,144,143,143,143,144,143,143,144,144,143,143,143,143,143,142,143,143,143,143,144,144,143,144,145,145,144,144,145,144,144,145,145,145,144,144,144,143,143,143,143,142,142,142,141,141,141,142,142,143,142,142,142,143,143,142,142,142,143,143,142,143,143,143,143,143,143,142,144,143,142,142,143,143,142,142,143,143,142,142,143,142,141,142,142,142,142,142,143,142,143,143,143,143,144,145,144,144,144,145,145,145,145,146,146,145,145,145,145,145,145,144,144,144],"pace":[467.9,null,354.9,349.0,349.0,349.0,330.8,308.0,292.1,288.9,276.2,276.2,276.2,282.8,282.8,282.8,284.3,285.8,285.8,285.1,284.3,282.8,282.8,282.8,282.0,281.3,279.8,276.9,276.9,276.9,276.9,276.9,272.7,272.0,272.0,271.3,271.3,270.0,270.0,270.0,271.3,272.7,273.4,274.1,276.9,276.9,276.9,277.6,278.4,278.4,276.2,276.2,275.5,275.5,274.8,274.1,274.1,274.1,273.4,272.0,271.3,271.3,271.3,271.3,271.3,270.6,270.0,270.0,270.0,270.0,270.0,270.0,270.0,270.0,270.0,270.0,270.6,270.6,271.3,271.3,272.7,272.7,272.7,272.7,271.3,271.3,270.6,270.0,269.3,269.3,269.3,269.3,269.3,270.0,270.0,269.3,269.3,269.3,270.0,270.0,270.0,270.0,272.0,272.0,273.4,273.4,274.8,275.5,275.5,275.5,275.5,275.5,275.5,276.2,277.6,279.1,279.8,279.8,280.6,280.6,280.6,280.6,280.6,280.6,280.6,279.8,279.8,279.1,279.1,279.1,279.1,279.1,279.1,279.1,279.8,279.8,279.1,279.8,279.8,279.8,280.6,281.3,281.3,281.3,282.0,282.0,282.8,283.5,284.3,284.3,285.1,285.1,285.1,285.8,286.5,288.1,288.1,288.9,288.9,288.9,288.9,288.9,288.9,289.7,289.7,289.7,289.7,289.7,290.4,290.4,290.4,290.4,290.4,290.4,291.2,291.2,292.1,292.8,293.6,293.6,293.6,293.6,292.8,292.8,294.5,294.5,295.2,295.2,296.0,296.9,297.7,297.7,298.5,298.5,299.4,300.2,301.0,301.0,301.0,301.0,300.2,300.2,298.5,296.9,296.0,295.2,295.2,295.2,295.2,295.2,295.2,295.2,295.2,295.2,295.2,295.2,295.2,296.9,296.9,296.0,296.0,295.2,295.2,295.2,295.2],"power":[377,320,488,485,539,552,555,602,636,644,671,664,650,628,607,620,623,631,640,641,643,649,645,642,642,636,637,644,641,643,634,616,623,620,614,617,614,616,611,605,596,589,590,590,582,575,569,562,559,570,578,583,590,588,576,571,561,552,556,559,561,562,556,552,549,547,545,545,542,544,544,541,537,535,536,536,536,533,520,520,513,509,511,514,515,515,513,515,518,522,524,531,538,540,549,559,566,579,583,589,593,605,608,616,621,626,631,637,647,655,651,650,658,668,675,693,703,711,721,730,733,729,723,724,731,733,735,733,731,730,732,730,727,716,706,697,686,671,665,661,647,642,633,622,606,595,587,585,581,577,578,576,572,561,555,550,550,550,547,543,541,539,540,531,527,527,527,528,525,521,518,515,513,511,495,492,490,487,487,493,492,492,496,491,482,478,473,470,467,464,462,465,463,464,460,454,456,455,458,458,455,455,454,463,464,474,474,475,478,484,490,493,497,504,511,523,562,561,569,575,573,575,549,555,568],"x_dist_m":[2.9,6.0,9.4,12.9,15.6,20.5,24.4,27.1,30.8,35.3,38.7,41.9,45.8,49.9,52.1,55.4,59.3,63.0,67.0,71.0,74.4,78.4,82.2,85.3,89.6,93.7,97.1,100.9,104.2,107.9,112.2,115.5,119.5,123.7,126.8,130.4,135.0,137.9,140.8,144.5,147.6,151.1,154.0,157.2,161.6,164.7,167.5,172.9,176.6,180.4,184.4,188.0,191.1,195.7,198.8,202.5,206.4,210.2,214.8,217.5,221.0,225.4,228.4,231.7,236.5,240.2,243.1,247.2,250.4,253.7,257.3,259.8,263.9,267.3,269.9,273.0,277.7,279.6,282.8,285.8,289.8,293.9,298.4,301.6,305.6,309.7,312.3,316.6,320.3,323.7,327.2,330.5,334.3,338.5,342.2,346.0,349.4,353.0,356.6,360.6,363.6,366.1,370.2,373.8,376.3,380.1,384.5,387.6,391.7,395.4,398.8,401.8,404.3,407.9,411.7,415.0,418.0,422.1,425.7,429.4,432.6,436.9,440.1,444.2,448.1,451.5,455.3,459.5,462.0,465.3,469.6,472.8,476.2,479.9,483.6,486.7,490.5,493.2,496.2,499.7,503.3,506.8,510.3,513.5,516.7,519.8,523.2,526.9,530.6,534.0,537.3,540.5,543.3,545.9,549.9,552.7,556.0,560.1,563.7,566.9,570.5,574.0,577.2,580.8,584.4,587.6,590.8,593.5,596.9,600.5,603.5,606.7,610.2,613.5,616.6,619.0,623.0,626.5,630.0,633.7,637.1,640.6,643.3,646.3,649.4,652.7,654.9,658.1,660.8,664.1,666.8,670.0,672.4,674.8,678.6,681.1,684.8,688.4,691.6,694.8,699.5,703.2,706.3,710.2,713.4,715.9,719.7,722.8,725.6,728.6,732.4,735.6,738.8,742.8,745.8,748.4,752.1,756.3,759.8,763.0,766.1,769.4,772.1,775.1,778.2],"x_elapsed_s":[0,1,2,3,4,5,6,7,8,9,10,11,12,13,14,15,16,17,18,19,20,21,22,23,24,25,26,27,28,29,30,31,32,33,34,35,36,37,38,39,40,41,42,43,44,45,46,47,48,49,50,51,52,53,54,55,56,57,58,59,60,61,62,63,64,65,66,67,68,69,70,71,72,73,74,75,76,77,78,79,80,81,82,83,84,85,86,87,88,89,90,91,92,93,94,95,96,97,98,99,100,101,102,103,104,105,106,107,108,109,110,111,112,113,114,115,116,117,118,119,120,121,122,123,124,125,126,127,128,129,130,131,132,133,134,135,136,137,138,139,140,141,142,143,144,145,146,147,148,149,150,151,152,153,154,155,156,157,158,159,160,161,162,163,164,165,166,167,168,169,170,171,172,173,174,175,176,177,178,179,180,181,182,183,184,185,186,187,188,189,190,191,192,193,194,195,196,197,198,199,200,201,202,203,204,205,206,207,208,209,210,211,212,213,214,215,216,217,218,219,220,221,222,223,224]},"splits":[{"elev_delta_m":-2.6,"hr":141,"km":1,"pace_s_per_km":287.8,"time_s":224.0}],"stride_m_avg":1.32,"title":"Run · 0.8 km","treadmill":false,"type":"road"}
