{"avg_pace_s_per_km":385.3,"best_efforts":[{"distance_m":1000,"label":"1k","plausible":true,"time_s":358.0},{"distance_m":1609.344,"label":"1mi","plausible":true,"time_s":582.8},{"distance_m":3000,"label":"3k","plausible":true,"time_s":1099.4},{"distance_m":5000,"label":"5k","plausible":true,"time_s":1869.2}],"best_pace_s_per_km":358.0,"cadence_avg":149.5,"date":"2025-11-05","device":"Venu 2 Plus","distance_m":6000.0,"elapsed_s":2352,"flags":{},"hr":{"avg":129,"max":137},"hr_zones":[{"seconds":1985,"zone":1},{"seconds":319,"zone":2},{"seconds":0,"zone":3},{"seconds":0,"zone":4},{"seconds":0,"zone":5},{"seconds":0,"zone":6},{"seconds":0,"zone":7}],"id":"2025-11-05-z22s","is_race":false,"moving_s":2312,"schema_version":1,"series":{"cadence":[0,30,82,136,142,146,150,150,148,150,148,148,148,152,152,154,152,152,154,156,152,152,152,152,154,154,152,154,152,152,156,154,156,152,154,156,152,154,154,156,156,154,156,154,154,154,156,154,154,154,156,156,154,156,156,156,156,154,156,156,154,154,156,154,154,156,156,156,156,156,156,158,156,156,154,154,156,156,154,154,154,156,154,154,158,154,156,156,154,156,154,154,156,156,156,154,156,154,154,156,154,156,156,156,156,154,154,156,156,154,154,156,154,156,154,154,154,154,154,154,156,156,156,154,158,154,156,154,154,154,154,156,156,156,154,152,148,150,150,148,150,148,148,150,152,154,154,154,152,154,154,152,154,154,154,154,154,154,154,156,158,154,156,156,154,156,156,156,154,154,156,154,154,148,148,148,148,148,148,148,150,152,144,146,146,146,148,148,148,148,146,148,150,150,148,148,150,152,150,150,150,152,148,150,148,148,150,146,146,146,144,144,144,146,144,146,144,146,148,148,144,148,146,150,148,148,148,150,146,146,144,144,144,144,144,146,146,144,144,144,146,148,150,146,144,144,144,146,146,144,146,146,144,144,144,144,144,144,144,142,146,144,104,100,104,0,102,106,104,108,0,0],"hr":[83,83,86,89,92,95,98,101,102,104,107,107,107,108,111,113,116,117,119,119,120,121,119,120,123,125,124,123,122,121,122,124,125,124,124,125,126,126,126,126,128,127,127,127,130,131,130,129,127,128,128,131,131,131,131,132,130,130,131,130,129,131,133,132,129,128,128,130,131,131,132,131,131,132,130,129,128,125,128,131,131,131,131,131,131,132,131,132,132,132,132,133,135,133,134,134,135,135,135,132,130,131,131,133,135,134,132,131,133,133,132,133,134,133,133,133,133,133,134,135,135,136,134,132,132,132,134,136,135,134,134,135,136,136,134,131,133,133,135,133,132,131,129,127,129,131,129,131,131,132,133,134,132,131,131,133,135,134,134,134,135,135,135,133,132,133,133,134,135,135,135,137,134,131,131,132,132,130,129,128,129,127,130,131,134,136,134,135,132,131,129,131,134,133,132,132,132,132,133,134,136,134,133,135,134,135,135,135,135,135,135,133,132,132,131,133,132,131,130,129,131,130,131,133,132,132,131,133,133,134,133,134,134,134,132,131,131,131,130,130,130,130,129,128,131,133,132,133,135,135,133,133,133,131,131,131,131,132,133,135,135,133,131,128,125,122,119,116,113,110,107,107],"pace":[null,null,null,939.8,259.5,344.6,421.9,413.7,413.7,413.7,413.7,412.2,412.2,412.2,395.4,384.2,385.5,386.8,389.7,378.6,389.7,388.3,395.4,391.1,392.6,395.4,392.6,388.3,388.3,399.8,407.5,402.9,401.4,407.5,417.0,404.4,406.0,406.0,415.5,404.4,401.4,398.4,398.4,397.0,395.4,395.4,404.4,410.7,409.0,407.5,409.0,406.0,402.9,394.0,395.4,307.1,391.1,397.0,397.0,399.8,399.8,407.5,392.6,395.4,406.0,410.7,410.7,404.4,399.8,404.4,404.4,412.2,412.2,406.0,417.0,417.0,430.5,432.2,423.5,413.7,412.2,407.5,407.5,418.6,417.0,410.7,412.2,412.2,410.7,407.5,409.0,402.9,397.0,407.5,412.2,421.9,427.0,389.7,391.1,406.0,415.5,418.6,418.6,255.2,401.4,401.4,402.9,399.8,398.4,409.0,413.7,409.0,412.2,413.7,407.5,410.7,417.0,427.0,412.2,421.9,427.0,402.9,418.6,421.9,427.0,421.9,421.9,413.7,417.0,418.6,417.0,430.5,421.9,423.5,420.3,421.9,446.6,452.3,437.4,448.4,435.7,444.6,450.2,446.6,423.5,417.0,421.9,413.7,407.5,399.8,399.8,255.2,430.5,398.4,415.5,397.0,389.7,417.0,409.0,420.3,407.5,404.4,402.9,412.2,417.0,418.6,430.5,423.5,418.6,423.5,417.0,410.7,415.5,427.0,450.2,450.2,454.1,456.0,458.1,441.1,417.0,432.2,439.2,454.1,458.1,460.0,460.0,450.2,456.0,456.0,458.1,439.2,427.0,413.7,412.2,406.0,394.0,399.8,401.4,313.4,397.0,421.9,423.5,425.4,415.5,407.5,417.0,439.2,446.6,448.4,456.0,452.3,454.1,460.0,452.3,464.0,456.0,452.3,456.0,417.0,417.0,428.6,417.0,432.2,409.0,418.6,428.6,433.8,454.1,460.0,460.0,460.0,427.0,433.8,444.6,439.2,448.4,452.3,461.9,458.1,454.1,439.2,441.1,441.1,439.2,441.1,442.9,359.6,399.8,412.2,430.5,439.2,446.6,452.3,448.4,444.6,415.5,417.0,417.0,418.6,418.6,425.4,619.6,634.1,665.8,null,1623.4,811.7,714.3,682.6,857.6,null],"x_dist_m":[0.0,0.0,0.3,6.6,28.3,36.5,41.9,49.9,74.1,98.2,114.2,138.4,162.6,186.8,200.5,223.1,237.5,260.6,283.3,306.5,329.7,352.5,375.1,397.7,411.9,434.5,456.7,479.6,502.6,524.8,549.5,574.2,598.9,623.6,648.0,671.9,696.5,720.9,745.2,769.7,791.9,816.8,841.7,864.2,880.9,903.2,925.6,950.1,974.4,998.8,1023.3,1047.8,1072.5,1097.1,1111.2,1133.9,1158.5,1181.1,1203.4,1225.7,1250.5,1275.2,1300.1,1322.8,1333.8,1358.2,1382.5,1407.0,1431.9,1456.6,1481.4,1505.8,1530.1,1554.0,1578.4,1602.4,1625.9,1649.0,1669.7,1691.0,1715.1,1739.3,1763.8,1787.9,1811.4,1836.2,1860.7,1884.9,1909.1,1933.5,1958.0,1982.2,2004.7,2029.4,2053.7,2077.6,2101.1,2125.9,2148.9,2168.2,2192.4,2216.4,2219.0,2242.1,2266.8,2289.1,2313.9,2338.6,2360.9,2385.6,2409.9,2434.2,2458.5,2482.8,2507.2,2531.5,2555.5,2579.3,2603.2,2627.1,2650.5,2674.3,2698.4,2722.2,2745.5,2769.3,2792.7,2816.7,2840.9,2864.8,2888.5,2912.0,2935.4,2958.9,2982.6,2990.5,3013.6,3038.0,3060.6,3083.3,3105.8,3128.5,3150.8,3173.1,3196.2,3219.8,3243.8,3267.6,3292.0,3316.6,3327.7,3351.4,3375.7,3399.7,3423.8,3447.8,3470.3,3495.1,3519.6,3543.6,3567.8,3592.4,3617.3,3641.6,3665.5,3689.3,3712.7,3736.2,3759.6,3783.0,3806.7,3830.9,3847.1,3857.5,3880.2,3904.7,3929.1,3953.4,3977.6,4002.2,4025.4,4048.8,4071.4,4093.6,4118.0,4142.1,4166.5,4190.7,4207.7,4232.0,4256.3,4281.0,4304.2,4327.9,4352.1,4376.4,4398.7,4421.2,4434.9,4458.4,4482.1,4506.5,4530.1,4553.6,4577.3,4601.4,4625.3,4648.4,4670.9,4695.5,4720.0,4744.3,4768.7,4792.7,4817.0,4841.2,4865.3,4889.8,4914.3,4937.4,4961.3,4985.0,5008.6,5031.6,5055.7,5079.9,5103.2,5126.4,5148.7,5172.8,5197.0,5221.1,5243.4,5266.5,5289.3,5311.9,5334.6,5358.9,5383.3,5407.3,5431.4,5453.9,5476.6,5499.3,5517.0,5539.7,5544.7,5568.4,5590.9,5615.7,5639.3,5662.2,5684.7,5709.3,5733.8,5756.2,5779.5,5803.5,5827.5,5851.4,5875.2,5899.0,5922.5,5929.7,5934.7,5939.7,5940.8,5954.8,5975.8,5988.6,6000.0,6000.0],"x_elapsed_s":[0,1,10,17,49,51,53,56,65,74,80,89,98,107,112,120,125,133,141,149,157,165,173,181,186,194,202,210,218,226,235,244,253,262,271,280,289,298,307,316,324,333,342,350,356,364,372,381,390,399,408,417,426,435,440,447,455,463,471,479,488,497,506,514,518,527,536,545,554,563,572,581,590,599,608,617,626,635,643,651,660,669,678,687,696,705,714,723,732,741,750,759,767,776,785,794,803,812,820,827,836,845,846,853,861,869,878,887,895,904,913,922,931,940,949,958,967,976,985,994,1003,1012,1021,1030,1039,1048,1057,1066,1075,1084,1093,1102,1111,1120,1129,1132,1141,1151,1160,1169,1178,1187,1196,1205,1214,1223,1232,1241,1250,1259,1263,1270,1278,1287,1296,1305,1313,1322,1331,1340,1349,1358,1367,1376,1385,1394,1403,1412,1421,1430,1439,1448,1454,1458,1467,1477,1487,1497,1507,1517,1526,1535,1544,1553,1563,1573,1583,1593,1600,1610,1620,1630,1639,1648,1657,1666,1674,1682,1687,1694,1702,1711,1720,1729,1738,1747,1756,1765,1774,1784,1794,1804,1814,1824,1834,1844,1854,1864,1874,1883,1892,1901,1910,1919,1928,1937,1946,1955,1964,1974,1984,1994,2003,2012,2021,2030,2039,2049,2059,2069,2079,2088,2097,2106,2113,2122,2124,2132,2140,2149,2158,2167,2176,2186,2196,2205,2214,2223,2232,2241,2250,2259,2270,2274,2277,2283,2290,2302,2316,2324,2350,2352]},"splits":[{"hr":117,"km":1,"pace_s_per_km":399.4,"time_s":399.4},{"hr":131,"km":2,"pace_s_per_km":365.9,"time_s":365.9},{"hr":134,"km":3,"pace_s_per_km":370.4,"time_s":370.4},{"hr":133,"km":4,"pace_s_per_km":380.4,"time_s":380.4},{"hr":132,"km":5,"pace_s_per_km":390.6,"time_s":390.6},{"hr":130,"km":6,"pace_s_per_km":443.3,"time_s":443.3}],"stride_m_avg":1.04,"title":"Treadmill run · 6.0 km","treadmill":true,"type":"indoor"}
