{"avg_pace_s_per_km":393.5,"best_efforts":[{"distance_m":1000,"label":"1k","plausible":true,"time_s":371.8},{"distance_m":1609.344,"label":"1mi","plausible":true,"time_s":604.1}],"best_pace_s_per_km":371.8,"cadence_avg":155.0,"date":"2026-03-08","device":"Venu X1","distance_m":2063.6,"elapsed_s":830,"elevation_gain_m":8.8,"elevation_loss_m":6.4,"flags":{},"hr":{"avg":115,"max":136},"hr_zones":[{"seconds":807,"zone":1},{"seconds":7,"zone":2},{"seconds":0,"zone":3},{"seconds":0,"zone":4},{"seconds":0,"zone":5},{"seconds":0,"zone":6},{"seconds":0,"zone":7}],"id":"2026-03-08-dvor","is_race":false,"moving_s":812,"schema_version":1,"series":{"cadence":[0,0,0,158,154,156,156,156,156,152,152,156,156,156,154,154,154,156,158,158,156,156,154,154,154,154,152,156,158,156,152,156,154,154,152,154,154,152,152,156,154,154,152,150,144,124,154,154,154,154,156,156,156,158,156,152,154,154,156,154,154,156,156,154,154,154,156,154,152,156,156,156,156,154,156,152,154,154,154,154,154,154,158,156,158,156,156,156,156,158,156,160,160,162,158,154,156,156,156,156,154,154,158,158,154,156,160,154,154,158,156,154,154,158,156,152,152,154,154,154,154,154,154,154,154,154,154,154,154,156,154,156,152,152,158,156,158,156,156,154,156,154,154,154,154,154,156,158,156,154,158,156,156,154,156,156,156,154,160,158,158,154,154,156,158,158,158,154,158,158,158,152,154,154,156,154,160,158,154,154,156,156,0,158,158,0,0,0,0,0,0,0,0,0,0,0,0,0,0,0],"elev":[42.4,42.4,42.2,42.6,43.0,43.4,43.6,43.8,43.8,44.2,44.0,44.2,44.2,44.2,44.4,44.4,44.4,44.4,44.4,44.4,44.6,44.8,44.8,45.0,45.0,45.0,45.4,45.4,45.8,45.8,46.0,46.0,46.2,46.2,46.2,46.4,46.4,46.4,46.4,45.8,46.2,46.4,46.4,46.4,46.4,46.4,46.4,46.2,45.8,45.6,45.4,45.4,45.2,44.6,44.2,43.6,43.2,43.0,42.4,42.2,42.2,42.0,41.8,42.0,42.2,42.2,42.6,43.0,43.2,43.6,44.0,44.2,44.2,44.2,44.6,44.0,43.6,43.4,43.2,43.2,43.2,43.2,43.0,42.4,42.2,42.4,42.0,42.0,41.8,42.0,42.0,41.2,41.6,41.6,41.6,41.2,41.2,41.0,40.6,40.4,40.4,40.6,40.8,41.0,41.0,41.2,41.2,41.4,41.4,41.4,41.8,42.0,42.2,42.4,42.4,42.6,42.6,43.0,43.0,43.4,43.4,43.8,44.4,44.6,44.6,45.0,44.6,44.4,44.0,43.8,43.6,43.6,43.6,43.4,43.0,43.0,42.8,42.6,42.4,42.4,42.4,42.4,42.4,42.4,42.4,42.4,42.0,41.6,41.4,41.4,41.0,40.8,40.6,40.6,40.8,40.8,41.0,41.0,41.2,41.4,41.6,41.8,41.8,42.2,42.4,42.4,42.4,42.2,42.2,42.4,42.6,43.0,43.4,43.4,43.8,44.0,44.4,44.4,44.6,44.8,45.2,45.4,45.2,45.2,45.2,45.2,45.0,45.0,44.8,44.8,44.8,44.8,44.6,44.6,44.4,44.4,44.6,44.6,44.6,44.8],"hr":[58,58,59,60,62,62,60,57,57,57,61,64,67,71,74,82,88,92,95,98,102,105,107,108,109,111,111,111,111,112,111,112,113,113,113,114,114,114,114,114,116,116,115,115,115,114,112,114,116,115,116,116,114,112,109,108,109,109,109,109,110,112,112,112,113,113,112,114,115,114,114,116,115,117,113,112,112,117,120,121,121,121,120,119,118,118,118,118,118,118,118,117,117,118,121,122,122,120,121,121,121,122,121,122,122,122,123,123,123,123,123,123,123,123,123,123,122,120,118,117,118,119,121,120,120,122,125,125,126,126,126,125,125,124,124,123,125,126,126,125,125,125,125,123,121,121,121,122,123,124,123,123,122,121,124,126,127,128,128,128,130,130,132,131,132,132,132,132,133,133,132,133,133,133,133,134,134,134,134,134,134,136,136,136,133,132,131,129,126,124,117,114,114,114,111,109,106,106,106,106],"pace":[1020.4,619.6,370.8,349.0,389.7,360.9,374.7,384.2,433.8,430.5,404.4,452.3,413.7,442.9,352.5,476.4,365.8,430.5,409.0,417.0,398.4,549.8,381.4,432.2,458.1,395.4,417.0,417.0,439.2,500.8,332.9,522.7,691.6,595.2,498.5,410.7,386.8,412.2,428.6,380.1,412.2,530.5,705.2,558.3,493.8,460.0,333.9,444.6,370.8,498.5,363.2,421.9,420.3,372.2,346.9,392.6,342.3,401.4,333.9,328.7,362.1,420.3,413.7,343.5,353.7,365.8,500.8,432.2,368.3,388.3,372.2,369.5,331.8,380.1,480.5,358.4,382.7,401.4,491.6,339.2,406.0,410.7,421.9,415.5,413.7,399.8,384.2,332.9,389.7,401.4,417.0,377.4,360.9,389.7,382.7,427.0,373.4,402.9,369.5,437.4,391.1,410.7,352.5,385.5,399.8,360.9,430.5,404.4,456.0,380.1,373.4,376.1,392.6,412.2,533.3,368.3,388.3,394.0,407.5,399.8,413.7,420.3,321.9,412.2,378.6,489.5,330.8,349.0,378.6,368.3,487.1,425.4,498.5,415.5,382.7,413.7,338.1,404.4,384.2,430.5,430.5,354.9,415.5,386.8,427.0,364.6,368.3,382.7,363.2,386.8,397.0,376.1,421.9,354.9,350.3,369.5,384.2,312.5,353.7,345.7,333.9,378.6,354.9,392.6,407.5,372.2,401.4,352.5,425.4,409.0,407.5,386.8,377.4,397.0,448.4,401.4,359.6,319.9,362.1,336.0,420.3,788.0,1002.0,871.1,null,1340.5,null,1675.0,null,null,null,1577.3,974.7,null,null,null,1552.8,885.7,1488.1,1261.0],"x_dist_m":[0.0,1.6,9.4,25.0,42.9,54.1,57.1,59.7,62.5,70.1,77.9,83.2,85.6,90.3,92.7,97.3,102.4,104.7,107.6,110.3,115.8,123.0,130.9,144.1,157.4,172.4,187.3,189.2,203.0,205.2,217.3,230.5,241.5,243.6,247.7,256.9,259.8,262.6,268.3,282.7,294.6,303.7,305.1,310.2,312.0,316.4,332.5,351.9,369.5,381.8,393.9,396.9,412.8,427.6,435.6,442.8,454.3,457.0,472.6,475.6,478.5,485.5,487.8,501.0,514.5,527.1,542.4,553.6,560.8,567.5,583.3,599.2,601.9,615.2,628.7,640.1,662.8,674.0,676.9,682.0,691.3,694.7,708.1,724.1,740.2,758.7,776.2,791.1,807.1,820.9,835.0,852.2,875.1,892.6,913.0,924.8,930.2,947.4,960.5,981.0,991.5,1005.0,1024.0,1042.5,1057.7,1069.7,1088.1,1106.0,1121.9,1133.6,1150.6,1167.8,1178.1,1181.9,1195.2,1201.9,1216.1,1234.7,1251.8,1259.1,1263.2,1276.7,1294.0,1307.4,1320.3,1335.5,1345.8,1348.7,1368.4,1385.1,1392.6,1398.1,1411.9,1418.9,1428.2,1444.4,1468.8,1487.5,1504.5,1518.6,1521.4,1533.3,1547.5,1567.0,1585.3,1603.1,1621.4,1636.9,1644.5,1650.7,1669.0,1679.6,1686.2,1701.7,1712.6,1721.1,1737.6,1756.0,1772.5,1790.2,1812.6,1827.2,1845.1,1866.0,1881.0,1883.8,1893.6,1904.1,1906.5,1911.3,1915.8,1932.8,1949.5,1952.3,1966.7,1980.6,1992.7,1995.7,2001.9,2011.3,2026.6,2036.7,2038.7,2040.4,2041.8,2042.8,2045.7,2049.0,2050.7,2051.9,2052.8,2052.8,2054.2,2059.3,2059.3,2059.3,2059.3,2061.9,2063.1,2063.6],"x_elapsed_s":[0,1,4,10,16,20,21,22,23,26,29,31,32,34,35,37,39,40,41,42,44,47,50,55,60,66,72,73,78,79,84,89,94,95,97,102,103,104,106,111,116,121,122,126,127,129,134,141,147,152,157,158,164,170,173,176,180,181,186,187,188,191,192,197,202,207,213,218,221,224,230,236,237,242,248,252,260,264,265,267,270,271,276,282,289,296,303,309,315,320,327,334,341,347,354,359,361,367,371,377,381,386,393,400,406,411,418,425,431,436,443,450,454,456,462,465,471,479,486,489,491,497,504,509,514,520,524,525,532,538,541,543,548,551,554,561,569,575,581,586,587,592,598,606,613,620,627,633,636,638,644,647,649,655,659,662,668,674,679,685,692,697,703,710,716,717,721,725,726,728,730,736,742,743,748,754,758,759,761,764,770,775,778,780,782,784,789,794,798,800,802,804,806,812,818,821,827,828,829,830]},"splits":[{"elev_delta_m":-1.9,"hr":106,"km":1,"pace_s_per_km":384.1,"time_s":384.1},{"elev_delta_m":4.0,"hr":125,"km":2,"pace_s_per_km":376.2,"time_s":376.2},{"elev_delta_m":0.3,"hr":122,"km":3,"pace_s_per_km":1094.5,"time_s":69.6}],"stride_m_avg":0.98,"title":"Run · 2.1 km","treadmill":false,"type":"road"}
